
1124|HM ARSYAD|-2.32428,112.56577|JL. HM ARSYAD SAMPIT KALIMANTAN TENGAH, KAB. KOTAWARINGIN TIMUR|74322|KAB. KOTAWARINGIN TIMUR|Kec. Mentawa Baru Ketapang|Kel. Mentawa Baru Hulu||Luar Jabodetabek|KALIMANTAN TENGAH|KALIMANTAN|(0531) 34746|
1127|TANJUNG REDEB|-2.15793, 117.50083|JL. S.A. MAULANA NO. 19 RT. 25/07 KEL TANJUNG REDEB, KEC. TANJUNG REDEB, KAB. BERAU |77311|KAB. BERAU|Kec. Tanjungredeb|Kel. Tanjungredeb||Luar Jabodetabek|KALIMANTAN TIMUR|KALIMANTAN|(0554) 21039, 21747, 22966, 26551, 26552, 26553, 26554| (0554) 21038
1128|TANJUNG SELOR|-3.14380, 117.40905|JL. PAHLAWAN NO. 88 TANJUNG SELOR, KALIMANTAN TIMUR.  CROWN SQUARE |77212|KAB. BULUNGAN|Kec. Tanjungpalas|Kel. Tanjungselor Ilir||Luar Jabodetabek|KALIMANTAN UTARA|KALIMANTAN|(0552)22504,2820|(0552)22508
1129|PASAR ADJI DILAYAS|-2.16602, 117.45895|KOMPLEKS RUKO SANGGAM JAYA LIMA A7 DAN A8, JL. HARM. AYOEB, KEL. RINDING, KEC. TELUK BAYUR, KAB. BERAU|77315|KAB. BERAU|Kec. Tanjungredeb|Kel. Telukbayur||Luar Jabodetabek|KALIMANTAN TIMUR|KALIMANTAN|(0554)2020071|(0554)2020072
1130|TARAKAN|-3.307815, 117.584302|JL.YOS SUDARSO NO.33, TARAKAN |77112|KOTA TARAKAN|Kec. Tarakan Barat|Kel. Karang Rejo||Luar Jabodetabek|KALIMANTAN UTARA|KALIMANTAN|(0551) 21048, 21049, 22377, 23170, 51777, 51046, 34744|(0551) 22366
1131|PASAR BERINGIN|-3.296236, 117.587424|JL. YOS SUDARSO RT. 13 NO. 13-14 TARAKAN|77112|KOTA TARAKAN|Kec. Tarakan Barat|Kel. Karang Rejo||Luar Jabodetabek|KALIMANTAN UTARA|KALIMANTAN|(0551).32223|(0552).22508
1132|MALINAU|-3.590752, 116.624244|JL. PANEMBAHAN MALINAU KALIMANTAN TIMUR|77554|KAB. MALINAU|Kec. Malinau|||Luar Jabodetabek|KALIMANTAN UTARA|KALIMANTAN|(0553)21035|
1133|TANA TIDUNG|-3.551868, 117.079409|JL. AMANTAWA RT I NO.12 TIDENG PALE KABUPATEN TANA TIDUNG, KALIMANTAN TIMUR|77152|KAB. TANA TIDUNG|Kec. Sesayap|||Luar Jabodetabek|KALIMANTAN UTARA|KALIMANTAN|(0553)2023688|
1134|KUALA KAPUAS D/H KC KUALA KAPUAS|-3.02052,114.39191|JL.JEND.A.YANI NO.1, KUALA KAPUAS |72113|KAB. KAPUAS|Kec. Pulau Laut Utara|Ds. Sebatung||Luar Jabodetabek|KALIMANTAN TENGAH|KALIMANTAN|(0513) 21026|(0513) 21659
1136|WILAYAH  10  JAKARTA SENAYAN|-6.206778,106.80369|JL. JEND. GATOT SUBROTO NO. 55, JAKARTA PUSAT|10210|KOTA JAKARTA PUSAT|Kec. Tanah Abang|Kel. Bendungan Hilir|IBUKOTA PROPINSI|JABODETABEK|DKI JAKARTA|JAWA|(021) 2500025-5706057 (Hunting)|(021)  2500033
1137|DUKUH BAWAH|-6.209994,106.82168|JL. JEND.SUDIRMAN KAV.21 KEC. SETIABUDI,  GEDUNG CHASE PLAZA LT. DASAR & LT. 2 |12920|KOTA JAKARTA SELATAN|Kec. Setiabudi|Kel. Karet|IBUKOTA PROPINSI|JABODETABEK|DKI JAKARTA|JAWA|(021) 5228918, 5228928, 5228430-31, 5228936-38,5228977, 5229053, 5228972, 5229065, 5229213-15|(021) 5228964, 68
1138|DEPLU RI|-6.174371,106.832953|JL. PEJAMBON NO.6 , JAKARTA PUSAT - DEPLU  |10110|KOTA JAKARTA PUSAT|Kec. Gambir|Kel. Gambir|IBUKOTA PROPINSI|JABODETABEK|DKI JAKARTA|JAWA|(021)  3858050|(021) 3447040
1139|WISMA BUMIPUTERA|-6.207349,106.822324|WISMA BUMIPUTERA, LT 2 SUITE 202 , JAKARTA SELATAN|12920|KOTA JAKARTA SELATAN|Kec. Setiabudi|Kel. Karet|IBUKOTA PROPINSI|JABODETABEK|DKI JAKARTA|JAWA|(021)  5713012|(021) 5277668
1140|WISMA BUNGA MAS D/H.  KARTIKA PLAZA|-6.201896,106.823385|JL. BLORA NO. 34 - 35, JAKARTA , WISMA BUNGA MAS |10310|KOTA JAKARTA PUSAT|Kec. Menteng|Kel. Menteng|IBUKOTA PROPINSI|JABODETABEK|DKI JAKARTA|JAWA|(021) 3901411, 31923696|(021) 3901411
1141|MENARA IMPERIUM D/H ATRIUM MULIA D/H .GEDUNG STAKO|-6.20796,106.829275|"GEDUNG MENARA IMPERIUM LANTAI B 1
JL. HR RASUNA SAID KAV 1
JAK-SEL"|12910|KOTA JAKARTA SELATAN|Kec. Setiabudi|Kel. Guntur|IBUKOTA PROPINSI|JABODETABEK|DKI JAKARTA|JAWA|(021) 83796742|(021) 83796743
1142|TEMPO SCAN TOWER DH/GRAHA. SURYA INTERNUSA|-6.235059,106.828953|GEDUNG TEMPO SCAN TOWER, GROUND FLOOR JL. HR RASUNA SAID KAV. NO.3 & 4 JAKARTA SELATAN|12950|KOTA JAKARTA SELATAN|Kec. Setiabudi|Kel. Kuningan Timur|IBUKOTA PROPINSI|JABODETABEK|DKI JAKARTA|JAWA|(021) 5278705|(021) 5278706
1143|MANGGARAI|-6.208219,106.844003|JL. SULTAN AGUNG NO. 60 KEL. PS.MANGGIS KEC. SETIABUDI |12970|KOTA JAKARTA SELATAN|Kec. Setiabudi|Kel. Pasar Manggis|IBUKOTA PROPINSI|JABODETABEK|DKI JAKARTA|JAWA|(021) 8352453, 8352541|(021) 8352452
1144|WISMA MULIA D/H.  ITC KUNINGAN|-6.234861,106.823368|JL. GATOT SUBROTO NO. 42, JAKARTA, GEDUNG WISMA MULIA GROUND.|12710|KOTA JAKARTA SELATAN|Kec. Mampang Prapatan|Kel. Kuningan Barat|IBUKOTA PROPINSI|JABODETABEK|DKI JAKARTA|JAWA|(021) 52906427|(021) 52906428
1145|PLAZA SUDIRMAN|-6.208378,106.822183|GROUND FLOOR UNIT F (SEMI GROSS) PLAZA SUDIRMAN, JL. JEND. SUDIRMAN KAV.76-78 JAKARTA SELATAN.|12920|KOTA JAKARTA SELATAN|Kec. Setiabudi|Kel. Karet|IBUKOTA PROPINSI|JABODETABEK|DKI JAKARTA|JAWA|(021)  57954586|(021) 57954587
1146|THE ENERGY|-6.22605,106.806593|GEDUNG THE ENERGY, GROUND FLOOR, KAWASAN SCBD JL. JEND. SUDIRMAN KAV. 52-53 JAKARTA SELATAN.|12190|KOTA JAKARTA SELATAN|Kec. Kebayoran Baru|Kel. Senayan|IBUKOTA PROPINSI|JABODETABEK|DKI JAKARTA|JAWA|(021)2505685|
1147|THE EAST|-6.229147,106.824557|GEDUNG THE EAST JL. LINGKAR MEGA KUNINGAN JAKARTA SELATAN|12950|KOTA JAKARTA SELATAN|Kec. Setiabudi|Kel. Kuningan Timur|IBUKOTA PROPINSI|JABODETABEK|DKI JAKARTA|JAWA|(021)57958096|
1148|MALL AMBASADOR|-6.223721,106.826468|RUKO NO. 5 MALL AMBASSADOR JL. PROF. SATRIO, JAKARTA SELATAN|12940|KOTA JAKARTA SELATAN|Kec. Setiabudi|Kel. Karet Kuningan|IBUKOTA PROPINSI|JABODETABEK|DKI JAKARTA|JAWA|(021)  57952048|(021)  57952049
1149|TELKOM LANDMARK TOWER D/H. RS MRCC|-6.218446,106.817016|GEDUNG TELKOM LANDMARK TOWER MENARA 1, LANTAI 1, JL. JENDRAL GATOT SUBROTO KAV. 52, JAKARTA SELATAN|12710|KOTA JAKARTA SELATAN|Kec. Mampang Prapatan|Kel. Kuningan Timur|IBUKOTA PROPINSI|JABODETABEK|DKI JAKARTA|JAWA|(021)  22533012|(021) 22533013
1150|BURSA EFEK INDONESIA D/H. SEMANGGI|-6.223593,106.808531|JL.JEND.SUDIRMAN KAV.52-53 , JAKARTA, GEDUNG JAKARTA STOCK EXCHANGE  LT.LL TOWER I |12190|KOTA JAKARTA SELATAN|Kec. Kebayoran Baru|Kel. Senayan|IBUKOTA PROPINSI|JABODETABEK|DKI JAKARTA|JAWA|(021)  5151348-51, 5151353|(021)  5151352
1151|SAMPOERNA STRATEGIC|-6.216614,106.817842|GEDUNG SAMPOERNO STRATEGIC SQUARE,GF TOWER B UNIT GF-5,  JL. JENDERAL SUDIRMAN KAV 45-46, KARET SEMANGGI, SETIABUDI, JAKARTA SELATAN 12930|12930|KOTA JAKARTA SELATAN|Kec. Setiabudi|Kel. Karet Semanggi|IBUKOTA PROPINSI|JABODETABEK|DKI JAKARTA|JAWA|(021)57950397|
1152|SETIA BUDI BUILDING|-6.21623,106.830128|JL. HR RASUNA SAID, KUNINGAN, JAKARTA SELATAN , GEDUNG  SETIABUDI ATRIUM LT. 1 SUITE 101B, |12940|KOTA JAKARTA SELATAN|Kec. Setiabudi|Kel. Karet Kuningan|IBUKOTA PROPINSI|JABODETABEK|DKI JAKARTA|JAWA|(021) 5207447,  5207471, 5220645|(021)  5207978
1153|WTC|-6.214915,106.820055|GEDUNG WORLD TRADE CENTRE, JL. JEND. SUDIRMAN KAV. 29-31, JAKARTA|12920|KOTA JAKARTA SELATAN|#REF!|Kel. Karet|IBUKOTA PROPINSI|JABODETABEK|DKI JAKARTA|JAWA|(021) 5211112|(021) 5211113
1154|LANDMARK|-6.203680, 106.823341|GD.LANDMARK,JL.JEND.SUDIRMAN NO.1 SETIABUDI,JAKARTA SELATAN|12190|KOTA JAKARTA SELATAN|Kec. Kebayoran Baru|Kel. Senayan|IBUKOTA PROPINSI|JABODETABEK|DKI JAKARTA|JAWA|(021)29023561|(021)29023562
1155|JAKARTA PUSAT|-6.203298,106.821362|JL. JEND. SUDIRMAN KAV.1 , JAKARTA PUSAT|10220|KOTA JAKARTA PUSAT|Kec. Tanah Abang|Kel. Karet Tengsin|IBUKOTA PROPINSI|JABODETABEK|DKI JAKARTA|JAWA|(021)  5728101 -19, 5728122,24,24,27 2511218-9, 2511220 - 22 - 23,   2511224 - 26 - 30|(021)  2511221, 25113219,21, 5709508, 5709506
1156|THE SULTAN HOTEL DH HOTEL HILTON|-6.21786,106.809669|JL. JEND. GATOT SUBROTO, PO BOX 3315, JAK-PUS|10210|KOTA JAKARTA PUSAT|Kec. Tanah Abang|Kel. Bendungan Hilir|IBUKOTA PROPINSI|JABODETABEK|DKI JAKARTA|JAWA|(021)  2510744 - 45 - 46, 5703600, 5707111|(021) 3161965
1157|PASAR TANAH ABANG BLOK A|-6.187406,106.814828|PASAR TANAH ABANG BLOK A LT. BASEMENT 2 LOS F NO. 78-79, TANAH ABANG, JAKARTA PUSAT|10250|KOTA JAKARTA PUSAT|Kec. Tanah Abang|Kel. Kampung Bali|IBUKOTA PROPINSI|JABODETABEK|DKI JAKARTA|JAWA|(021) 23571884|(021) 23572129
1158|PLAZA INDONESIA|-6.193736,106.82145|JL. MH.THAMRIN KAV. 28-30 JAKARTA PUSAT. PLAZA INDONESIA UNIT L4 # 31  |10350|KOTA JAKARTA PUSAT|Kec. Menteng|Kel. Gondangdia|IBUKOTA PROPINSI|JABODETABEK|DKI JAKARTA|JAWA|(021) 29923566|
1159|FX SUDIRMAN D/H PLAZA FX STYLE|-6.224575,106.803954|PLZA FX LIFESTYLE X'NTER, UNIT F2# 14, JL. JEND.SUDIRMAN - PINTU SATU SENAYAN, JAKARTA PUSAT.|10270|KOTA JAKARTA PUSAT|Kec. Tanah Abang|Kel. Gelora|IBUKOTA PROPINSI|JABODETABEK|DKI JAKARTA|JAWA|(021)25554046|
1160|SUDIRMAN PARK|-6.204974,106.817593|JL. KH MAS MANSYUR KAV. 35. KARET TENGSIN, JAKARTA PUSAT|10220|KOTA JAKARTA PUSAT|Kec. Tanah Abang|Kel. Karet Tengsin|IBUKOTA PROPINSI|JABODETABEK|DKI JAKARTA|JAWA|(021)  57943851|(021) 57943890
1161|PASAR TANAH ABANG BLOK B|-6.187935,106.814716|"PASAR REGIONAL TANAH ABANG BLOK B LANTAI 5 LOSE F. 9-11
, JL. KH FACHRUDIN,KEL. KAMPUNG BALI, KEC. TANAH ABANG, JAKARTA PUSAT"|10250|KOTA JAKARTA PUSAT|Kec. Tanah Abang|Kel. Kampung Bali|IBUKOTA PROPINSI|JABODETABEK|DKI JAKARTA|JAWA|(021)  23573100 |(021) 23573101 
1162|WISMA 46|-6.203503,106.820563|GD. WISMA 46 KOTA BNI LT. DASAR JL. JEND.SUDIRMAN , KAV.1, JAK-PUS|10220|KOTA JAKARTA PUSAT|Kec. Tanah Abang|Kel. Karet Tengsin|IBUKOTA PROPINSI|JABODETABEK|DKI JAKARTA|JAWA|(021)  5728391 -94, 5728397, 5729143|(021)  5744646
1163|GRAND INDONESIA D/H  ASCOTT (D/H HOTEL INDONESIA) |-6.195772,106.822114|GRAND INDONESIA WEST MALL LANTAI  5 SHOP UNIT GD 2-16,17 (SHOP UNIT-1), JL. MH THAMRIN NO. 1 - JAKARTA|10230|KOTA JAKARTA PUSAT|Kec. Tanah Abang|Kel. Kebon Melati|IBUKOTA PROPINSI|JABODETABEK|DKI JAKARTA|JAWA|(021)  23580446|(021) 23580346
1164|TANAH ABANG|-6.185207,106.814542|JL. KH. FACHRUDIN NO. 36 PERTOKOAN TANAH ABANG BUKIT BLOK A NO. 51 - 52 - 53, JAK - PUS|10250|KOTA JAKARTA PUSAT|Kec. Tanah Abang|Kel. Kampung Bali|IBUKOTA PROPINSI|JABODETABEK|DKI JAKARTA|JAWA|(021) 3143820, 31927724, 3145864, 31934450, 3143847|(021) 31927926
1165|PASAR TANAH ABANG|-6.188736,106.815575|JL KH MAS MANSYUR NO. 5A KEBON KACANG TANAH ABANG |10250|KOTA JAKARTA PUSAT|Kec. Tanah Abang|Kel. Kampung Bali|IBUKOTA PROPINSI|JABODETABEK|DKI JAKARTA|JAWA|(021) 3925813|(021) 3928026
1166|THAMRIN CITY|-6.194866,106.817497|THAMRIN CITY AREAL DROP OFF, JL. TMAHRIN BOULEVARD, JAKARTA PUSAT|10230|KOTA JAKARTA PUSAT|Kec. Tanah Abang|Kel. Kebon Melati|IBUKOTA PROPINSI|JABODETABEK|DKI JAKARTA|JAWA|(021)31990822|
1167|METRO TANAH ABANG DH. TANAH ABANG BLOK A1|-6.187406,106.814828|GEDUNG PUSAT GROSIR METRO TANAH ABANG, JL. KH WAHID HASYIM JAKARTA PUSAT|10250|KOTA JAKARTA PUSAT|Kec. Tanah Abang|Kel. Kampung Bali|IBUKOTA PROPINSI|JABODETABEK|DKI JAKARTA|JAWA|(021)23571444|
1168|TANAH ABANG BLOK B1|-6.187935,106.814716|TANAH ABANG BLOK B LANTAI 1 LOS H NO.087 JL. FACHRUDDIN NO.1 KAMPUNG BALI,JAKARTA PUSAT|10250|KOTA JAKARTA PUSAT|Kec. Tanah Abang|Kel. Kampung Bali|IBUKOTA PROPINSI|JABODETABEK|DKI JAKARTA|JAWA|(021)23574430|
1169|TANAH ABANG BLOK B2|-6.187935,106.814716|TANAH ABANG BLOK B LANTAI B2 LOS H NO.068, JL. FACHRUDDIN NO.1 KAMPUNG BALI, JAKARTA PUSAT|10250|KOTA JAKARTA PUSAT|Kec. Tanah Abang|Kel. Kampung Bali|IBUKOTA PROPINSI|JABODETABEK|DKI JAKARTA|JAWA|(021)23574445|
1170|TANAH ABANG BLOK A2|-6.187406,106.814828|TANAH ABANG BLOK A LANTAI 2 LOS E NO.150 JL. FACHRUDDIN NO.1 KAMPUNG BALI, JAKARTA PUSAT|10250|KOTA JAKARTA PUSAT|Kec. Tanah Abang|Kel. Kampung Bali|IBUKOTA PROPINSI|JABODETABEK|DKI JAKARTA|JAWA|(021)23570952|
1171|PASAR BENHIL|-6.214089,106.814295|JL. BENDUNGAN HILIR RAYA NO. 84 C, JAKARTA PUSAT|10210|KOTA JAKARTA PUSAT|Kec. Tanah Abang|Kel. Bendungan Hilir|IBUKOTA PROPINSI|JABODETABEK|DKI JAKARTA|JAWA|(021)57901454|
1172|WAHID HASYIM|-6.187074,106.825004|JL. WAHID HASYIM NO.55 JAKARTA PUSAT|10350|KOTA JAKARTA PUSAT|Kec. Menteng|Kel. Gondangdia|IBUKOTA PROPINSI|JABODETABEK|DKI JAKARTA|JAWA|(021)31906296|(021)31905493
1173|THE CITY CENTRE|-6.211317,106.816151|GEDUNG TCC BATAVIA TOWER ONE LANTAI 2A UNIT 03, JL. KH MAS MANSYUR KAV.126 KARET TENGSIN, JAKARTA PUSAT|10230|KOTA JAKARTA PUSAT|Kec. Tanah Abang|Kel. Kebon Melati|IBUKOTA PROPINSI|JABODETABEK|DKI JAKARTA|JAWA|(021)29529470|(021)29529471
1174|GAMA TOWER|-6.223663, 106.833082||12970|KOTA JAKARTA PUSAT|Kec. Setiabudi|Kel. Pasar Manggis|IBUKOTA PROPINSI|JABODETABEK|DKI JAKARTA|JAWA|(021)  29203906|
1175|THAMRIN RESIDENCE OFFICE PARK|-6.197079, 106.817186|THAMRIN RESIDENCE OFFICE PARK, JL. THAMRIN BOULEVARD, JAKARTA PUSAT|12830|KOTA JAKARTA PUSAT|Kec. Tebet|Kel. Kebon Baru|IBUKOTA PROPINSI|JABODETABEK|DKI JAKARTA| JAWA |(021) 29932520|
1178|MELAWAI RAYA D/H  KEBAYORAN BARU|-6.245952,106.803723|JL. MELAWAI RAYA NO. 1  KEBAYORAN BARU, JAK-SEL |12160|KOTA JAKARTA SELATAN|Kec. Kebayoran Baru|Kel. Pulo|IBUKOTA PROPINSI|JABODETABEK|DKI JAKARTA|JAWA|(021)  2700946/48, 72801460, 72801462, 72801465, 2700949, 2700950, 2700950, 2700585, 2700587, 2701046, 2702817, 2702818, 2702846, 2702847, 72801464, 72801467, 72801468, 72797468, 72795751, 72798014, 72799250|(021)  2700950
1179|KEMANG (D/H KCP GEDUNG BPN)|-6.269629,106.815403|JL. KEMANG RAYA NO. 82 D JAKARTA SELATAN |12730|KOTA JAKARTA SELATAN|Kec. Mampang Prapatan|Kel. Bangka|IBUKOTA PROPINSI|JABODETABEK|DKI JAKARTA|JAWA|(021) 7180366, 7199454, 7180366|(021)  7182714
1180|WIJAYA GRAND CENTER|-6.254615,106.800261|JL. DARMAWANGSA RAYA, KOMPL. WIJAYA GRAHA PURI BLOK E 2-3, JAK-SEL |12160|KOTA JAKARTA SELATAN|Kec. Kebayoran Baru|Kel. Pulo|IBUKOTA PROPINSI|JABODETABEK|DKI JAKARTA|JAWA|(021)  7202880, 7202881, 7206908, 7228323, 7200138|(021) 2700582
1181|BLOK M D/H. KALIBATA ( TEBET)|-6.243971,106.798758|JL. SULTAN  HASANUDDIN NO. 3-4, JAKARTA SELATAN |12160|KOTA JAKARTA SELATAN|Kec. Kebayoran Baru|Kel. Pulo|IBUKOTA PROPINSI|JABODETABEK|DKI JAKARTA|JAWA|(021) 2700947, 2700945|(021) 2700947
1182|PLN PUSAT|-6.239081,106.803379|JL. TRUNOJOYO BLOK M1 NO. 135 KEBAYORAN BARU, JAKARTA SELATAN|12110|KOTA JAKARTA SELATAN|Kec. Kebayoran Baru|Kel. Selong|IBUKOTA PROPINSI|JABODETABEK|DKI JAKARTA|JAWA|(021) 72789925|(021) 72789422
1183|PANGLIMA POLIM|-6.253955,106.797361|JL.FATMAWATI RAYA NO.47 E-F, JAKARTA SELATAN|12160|KOTA JAKARTA SELATAN|Kec. Kebayoran Baru|Kel. Pulo|IBUKOTA PROPINSI|JABODETABEK|DKI JAKARTA|JAWA|(021) 7395251|(021) 77244259
1184|WARUNG BUNCIT|-6.265774,106.835904|JL.WARUNG BUNCIT RAYA NO.2, KALIBATA, JAKARTA SELATAN|12740|KOTA JAKARTA SELATAN|Kec. Pancoran|Kel. Kalibata|IBUKOTA PROPINSI|JABODETABEK|DKI JAKARTA|JAWA|(021) 7940138|(021) 7946662
1185|AMPERA|-6.289511,106.818093|JL. AMPERA RAYA NO.62A KEL. CILANDAK TIMUR, KEC. PASAR MINGGU, JAKARTA SELATAN|12560|KOTA JAKARTA SELATAN|Kec. Pasar Minggu|Kel. Cilandak Timur|IBUKOTA PROPINSI|JABODETABEK|DKI JAKARTA|JAWA|(021) 7806490|(021) 7802454
1186|PEJATEN VILLAGE|-6.280308,106.828806|MALL PEJATEN VILLAGE, JL. WARUNG JATI BARAT NO. 39 JATI PADANG PASAR MINGGU JAKARTA SELATAN 12540|12540|KOTA JAKARTA SELATAN|Kec. Pasar Minggu|Kel. Jati Padang|IBUKOTA PROPINSI|JABODETABEK|DKI JAKARTA|JAWA|(021) 78831687|(021) 78831669
1187|BANGKA RAYA|-6.250858,106.814598|JL. BANGKA RAYA NO. 40A RT. 014 RW. 03 PELA MAMPANG JAKARTA SELATAN, 12720|12720|KOTA JAKARTA SELATAN|Kec. Mampang Prapatan|Kel. Pela Mampang|IBUKOTA PROPINSI|JABODETABEK|DKI JAKARTA|JAWA|(021) 7194210, 7194217| (021) 7194139
1188|RADIO DALAM|-6.252026,106.79128|JL. RADIO DALAM RAYA NO. 24, KEBAYORAN BARU, JAKARTA SELATAN|12140|KOTA JAKARTA SELATAN|Kec. Kebayoran Baru|Kel. Gandaria Utara|IBUKOTA PROPINSI|JABODETABEK|DKI JAKARTA|JAWA|(021) 7234371|(021) 7234368
1189|PACIFIC PLACE|-6.224529,106.810197|GEDUNG PACIFIC PLACE, JL. JEND SUDIRMAN KAV 52-53, JAKARTA SELATAN|12190|KOTA JAKARTA SELATAN|Kec. Kebayoran Baru|Kel. Senayan|IBUKOTA PROPINSI|JABODETABEK|DKI JAKARTA|JAWA|(021) 51400512|(021) 51400588
1190|MELAWAI|-6.245727,106.79617|JL. MELAWAI RAYA NO. 75 KEBAYORAN BARU, JAK-SEL|12130|KOTA JAKARTA SELATAN|Kec. Kebayoran Baru|Kel. Kramat Pela|IBUKOTA PROPINSI|JABODETABEK|DKI JAKARTA|JAWA|(021)  2702828, 2702838, 2702651, 2702652, 7211124, 7211125|(021) 2700048
1191|MONGINSIDI D/H CIRANJANG D/H KELAPA GADING  ( RAWAMANGUN)|-6.239716,106.806057|RUKAN DE MONGINSIDI JL. WOLTER MONGINSIDI NO.12-14  RT 002 RW 002, MELAWAI, KEBAYORAN BARU,JAKARTA SELATAN|12160|KOTA JAKARTA SELATAN|Kec. Kebayoran Baru|Kel. Pulo|IBUKOTA PROPINSI|JABODETABEK|DKI JAKARTA|JAWA|(021) 7231537,7266487,7250717|(021) 7251003
1192|MAMPANG|-6.240396,106.825584|JL. MAMPANG PRAPATAN NO. 37 , JAKARTA SELATAN|12790|KOTA JAKARTA SELATAN|Kec. Mampang Prapatan|Kel. Tegal Parang|IBUKOTA PROPINSI|JABODETABEK|DKI JAKARTA|JAWA|(021) 7985513|(021) 7941303
1193|DUTA MAS FATMAWATI|-6.263649,106.797895|JL. RS.FATMAWATI NO.39 , JAK-SEL, KOMP. PERTOKOAN ITC FATMAWATI BLOK B1 NO.5. |12150|KOTA JAKARTA SELATAN|Kec. Kebayoran Baru|Kel. Cipete Utara|IBUKOTA PROPINSI|JABODETABEK|DKI JAKARTA| JAWA |(021) 72796328|(021) 7237410
1194|KEMANG RAYA|-6.255402,106.813414|JL. KEMANG RAYA NO.15 KELURAHAN BANGKA, KEC. MAMPANG PRAPATAN, KODYA JAKARTA SELATAN|12730|KOTA JAKARTA SELATAN|Kec. Mampang Prapatan|Kel. Bangka|IBUKOTA PROPINSI|JABODETABEK|DKI JAKARTA|JAWA|(021)71794595|
1195|CIPETE|-6.277154,106.797739|JL. FATMAWATI NO. 33 KELURAHAN CIPETE SELATAN, KEC. CILANDAK, JAKARTA SELATAN|12410|KOTA JAKARTA SELATAN|Kec. Cilandak|Kel. Cipete Selatan|IBUKOTA PROPINSI|JABODETABEK|DKI JAKARTA|JAWA|(021)75921200|
1196|DUREN TIGA|-6.253862,106.832781|JL. DUREN TIGA RAYA NO. 7C, KEL. DUREN TIGA, KEC. PANCORAN, KOTA  JAKARTA SELATAN|12760|KOTA JAKARTA SELATAN|Kec. Pancoran|Kel. Duren Tiga|IBUKOTA PROPINSI|JABODETABEK|DKI JAKARTA|JAWA|(021)79188372|
1197|KEMENTRIAN PU|-6.234563,106.801005|KEMENTRIAN PU, JL. PATTIMURA NO.20, KEL. SELONG, KEC. KEBAYORAN BARU, KOTA JAKARTA SELATAN|12110|KOTA JAKARTA SELATAN|Kec. Kebayoran Baru|Kel. Selong|IBUKOTA PROPINSI|JABODETABEK|DKI JAKARTA|JAWA|(021)7207741|(021)7207754
1198|FATMAWATI RAYA|-6.286377,106.795568|JL. FATMAWATI RAYA KEL. CILANDAK BARAT, KEC. CILANDAK, KOTA JAKARTA SELATAN|12430|KOTA JAKARTA SELATAN|Kec. Cilandak|Kel. Cilandak Barat|IBUKOTA PROPINSI|JABODETABEK|DKI JAKARTA|JAWA|(021)7698345|(021)7505496
1201|MENTENG|-6.186614,106.835868|JL. MENTENG RAYA NO. 76, JAKARTA PUSAT|10340|KOTA JAKARTA PUSAT|Kec. Menteng|Kel. Kebon Sirih|IBUKOTA PROPINSI|JABODETABEK|DKI JAKARTA|JAWA|(021)  31931723, 31934550, 31936226, 3100462|(021)   3907526 (021)   3907527
1202|STASIUN K.A. GAMBIR|-6.177956,106.831374|JL. MEDAN MERDEKA TIMUR, JAKARTA PUSAT, STASIUN GAMBIR PINTU UTARA |10110|KOTA JAKARTA PUSAT|Kec. Gambir|Kel. Gambir|IBUKOTA PROPINSI|JABODETABEK|DKI JAKARTA|JAWA|(021)  3506624|(021) 3506625
1203|DEPARTEMEN PERTAHANAN (DEPHAN) D/H HOTEL SAHID |-6.177165,106.822041|JL. MEDAN MERDEKA BARAT NO. 13-14 JAKARTA PUSAT  |10110|KOTA JAKARTA PUSAT|Kec. Gambir|Kel. Gambir|IBUKOTA PROPINSI|JABODETABEK|DKI JAKARTA|JAWA| (021) 3828152, 3518177|(021)   3518177
1204|SABANG|-6.186617,106.825032|JL. H. AGUS SALIM NO. 44 JAKARTA PUSAT|10340|KOTA JAKARTA PUSAT|Kec. Menteng|Kel. Kebon Sirih|IBUKOTA PROPINSI|JABODETABEK|DKI JAKARTA|JAWA|(021) 3103006|(021)  3103007
1205|PLAZA MENTENG|-6.196867,106.828883|JL. HOS COKROAMINOTO, MENTENG, JAKARTA PUSAT|10310|KOTA JAKARTA PUSAT|Kec. Menteng|Kel. Menteng|IBUKOTA PROPINSI|JABODETABEK|DKI JAKARTA|JAWA|(021) 3907620|(021) 3907621
1206|CIKINI|-6.19317,106.838934|JL. CIKINI RAYA KAV. 62-64 JAKARTA PUSAT 10330|10330|KOTA JAKARTA PUSAT|Kec. Menteng|Kel. Cikini|IBUKOTA PROPINSI|JABODETABEK|DKI JAKARTA|JAWA|(021) 21392162|(021) 21392163
1207|PROKLAMASI|-6.202245,106.846884|GEDUNG PROKLAMASI MANSION, JL. PROKLAMASI NO.68 RT 002/005 PEGANGSAAN, JAKARTA PUSAT|10320|KOTA JAKARTA PUSAT|Kec. Menteng|Kel. Pegangsaan|IBUKOTA PROPINSI|JABODETABEK|DKI JAKARTA|JAWA|(021) 3924614|(021) 31922839
1208|CIKINI GOLD CENTRE|-6.198302,106.841489|CIKINI GOLD CENTRE LANTAI 2 BLOK AKS001, JL. CIKINI RAYA, JAKARTA PUSAT|10320|KOTA JAKARTA PUSAT|Kec. Menteng|Kel. Pegangsaan|IBUKOTA PROPINSI|JABODETABEK|DKI JAKARTA|JAWA|(021)29565446|(021)29565447
1209|PASAR MAYESTIK|-6.241661,106.790454|JL. KYAI MAJA NO.75-76 KEBAYORAN BARU, JAK-SEL|12120|KOTA JAKARTA SELATAN|Kec. Kebayoran Baru|Kel. Gunung|IBUKOTA PROPINSI|JABODETABEK|DKI JAKARTA|JAWA|(021)   2700049 - 2700050, 2700951, 7262455, 2702949, 2702831, 7248779, 72797763, 7200584, 72792659, 72788839, 7201037,72787227, 70800262|(021) 2700952
1210|CIPULIR|-6.237757,106.767873|JL. CILEDUG RAYA NO.123 ABC, JAKSEL |12230|KOTA JAKARTA SELATAN|Kec. Kebayoran Lama|Kel. Cipulir|IBUKOTA PROPINSI|JABODETABEK|DKI JAKARTA|JAWA|(021) 72800158, ULM Cipulir (021) 72795756, 72796985|(021) 72800157
1211|GANDARIA D/H  RADIO DALAM|-6.24457,106.783424|JL. GANDARIA TENGAH III NO. 21 KEBAYORAN BARU, JAKSEL, GEDUNG GRAHA FINDO, |12130|KOTA JAKARTA SELATAN|Kec. Kebayoran Baru|Kel. Kramat Pela|IBUKOTA PROPINSI|JABODETABEK|DKI JAKARTA|JAWA|(021)  72795964|(021) 72795978
1212|KEBAYORAN LAMA|-6.236216,106.780338|JL. RAYA KEBAYORAN LAMA NO. 17 A-B KEL.GROGOL SELATAN KEBAYORAN LAMA |12224|KOTA JAKARTA SELATAN|#N/A|#N/A|IBUKOTA PROPINSI|JABODETABEK|DKI JAKARTA|JAWA|(021) 7235357, ULM Keb. Lama (021) 72788443, 72788445|(021) 7233861
1213|JOGLO D/H. APARTEMEN PERMATA|-6.218026,106.757022|RUKO JOGLO, PERUMAHAN TAMAN KEBON JERUK BLOK W.III NO. 19, JAKARTA BARAT  |11550|KOTA JAKARTA BARAT|Kec. Kebon Jeruk|Kel. Kelapa Dua|IBUKOTA PROPINSI|JABODETABEK|DKI JAKARTA|JAWA|(021) 70901546, 5874514|(021) 5874514
1214|SENAYAN CITY|-6.227892,106.796381|MALL SENAYAN CITY, JL. ASIA AFRIKA LOT 19, GELORA, TANAH ABANG, JAKARTA PUSAT|10270|KOTA JAKARTA PUSAT|Kec. Tanah Abang|Kel. Gelora|IBUKOTA PROPINSI|JABODETABEK|DKI JAKARTA|JAWA|(021) 72782139|(021) 72782141
1215|ITC PERMATA HIJAU|-6.22102,106.783316|GEDUNG ITC PERMATA HIJAU, JL ARTERI PERMATA HIJAU RAYA BLOK EMERALD NO.1, JAKARTA BARAT|12210|KOTA JAKARTA SELATAN|Kec. Kebayoran Lama|Kel. Grogol Utara|IBUKOTA PROPINSI|JABODETABEK|DKI JAKARTA|JAWA|(021) 53664464|
1216|GANDARIA CITY|-6.24457,106.783424|PERKANTORAN GANDARIA 8, JL. SULTAN ISKANDAR MUDA,JAKARTA SELATAN|12240|KOTA JAKARTA SELATAN|Kec. Kebayoran Lama|Kel. Kebayoran Lama Utara|IBUKOTA PROPINSI|JABODETABEK|DKI JAKARTA|JAWA|(021) 29036646 |(021) 29036647 
1217|PONDOK INDAH ARTERI|-6.251442,106.781723|JL. SULTAN ISKANDAR MUDA NO. 25 (ARTERI PONDOK INDAH NO.1) JAK-SEL |12240|KOTA JAKARTA SELATAN|Kec. Kebayoran Lama|Kel. Kebayoran Lama Utara|IBUKOTA PROPINSI|JABODETABEK|DKI JAKARTA|JAWA|(021) 7227885, 7257540, 7257542, 7257543, 7229552, 7229554, 7229556, 7229558, 72798077|(021) 7257541
1218|PONDOK PINANG|-6.258278,106.777674|JL. CIPUTAT RAYA NO. 16 PONDOK PINANG, JAKSEL|12310|KOTA JAKARTA SELATAN|Kec. Kebayoran Lama|Kel. Pondok Pinang|IBUKOTA PROPINSI|JABODETABEK|DKI JAKARTA|JAWA|(021) 7506015|(021) 7651646
1219|VETERAN BINTARO D/H STP TRISAKTI (D/H  APT TRISAKTI)|-6.261253,106.767113|JL. RAYA RC VETERAN NO. 2 BINTARO, JAKARTA SELATAN|12330|KOTA JAKARTA SELATAN|Kec. Pesanggrahan|Kel. Bintaro|IBUKOTA PROPINSI|JABODETABEK|DKI JAKARTA|JAWA|(021) 7342577|(021) 73884869
1220|RS PUSAT PERTAMINA |-6.240238,106.79292|JL. KYAI MAJA NO.43 KEBAYORAN BARU, JAKARTA SELATAN|12120|KOTA JAKARTA SELATAN|Kec. Kebayoran Baru|Kel. Gunung|IBUKOTA PROPINSI|JABODETABEK|DKI JAKARTA|JAWA|(021) 7219594,7219564|(021) 7219864
1221|KREO|-6.235516,106.74073|JL. HOS COKROAMINOTO, KREO, KEC. LARANGAN, KOTA TANGERANG|15156|KOTA TANGERANG|Kec. Larangan|Kel. Kreo Selatan||JABODETABEK|BANTEN|JAWA|(021)73880999|
1222|SANTA|-6.239183,106.811417|JL. WOLTER MONGINSIDI NO. 60B KEBAYORAN BARU, JAKARTA SELATAN|12110|KOTA JAKARTA SELATAN|Kec. Kebayoran Baru|Kel. Selong|IBUKOTA PROPINSI|JABODETABEK|DKI JAKARTA|JAWA|(021)7254455|(021)7220569
1223|CIPADU|-6.248219,106.738478|JL. KH. WAHID HASYIM, CIPADU, KOTA TANGERANG|15155|KOTA TANGERANG|Kec. Larangan|Kel. Cipadu Jaya||JABODETABEK|BANTEN|JAWA|(021)73451946|(021)73451846
1224|PASAR MAYESTIK(KK)|-6.241231,106.790969|GEDUNG PASAR MAYESTIK UNIT L 2 BKS SLOT B, JL. TEBAH 3, KEBAYORAN BARU, KOTA JAKARTA SELATAN, DKI JAKARTA|12120|KOTA JAKARTA SELATAN|Kec. Kebayoran Baru|Kel. Gunung|IBUKOTA PROPINSI|JABODETABEK|DKI JAKARTA|JAWA|(021)29395546|(021)29395547
1226|SENAYAN|-6.207125,106.803674|JL. JEND. GATOT SUBROTO KAV.55, JAK-PUS |10210|KOTA JAKARTA PUSAT|Kec. Tanah Abang|Kel. Bendungan Hilir|IBUKOTA PROPINSI|JABODETABEK|DKI JAKARTA|JAWA|(021)  5707474 (hunting), 5703977, 5735083, 2511279, 2511280, 2511281, 5723869, 5723870, 5723908, 5735081, 5747649, 5747789, 5735041, 5702509, 5702511, 5702912, 7250808|(021) 2511280, 2511282
1227|RATU PLAZA|-6.226954,106.800513|JL. JEND. SUDIRMAN KAV.09 GROUND FLOOR , JAK-PUS|10720|KOTA JAKARTA PUSAT|Kec. Sawah Besar|Kel. Gunung Sahari Utara|IBUKOTA PROPINSI|JABODETABEK|DKI JAKARTA|JAWA|(021)  2700045-7, 5710506, 5710576, 7207895|(021) 5710705
1228|PLAZA SEMANGGI D/H.  CENTRAL PLAZA|-6.208378,106.822183|GEDUNG PLAZA SEMANGGI, JL. JENDERAL SUDIRMAN KAV.50, LOBBY AREA, UNIT #003 - JAKARTA |12930|KOTA JAKARTA SELATAN|Kec. Setiabudi|Kel. Karet Semanggi|IBUKOTA PROPINSI|JABODETABEK|DKI JAKARTA|JAWA|(021)  25539830, 25539831|(021) 25539831
1229|WISMA GKBI|-6.217407,106.812831|JL. JEND. SUDIRMAN NO. 28 JAKPUS D/H WISMA GKBI LT.5, JL. JEND SUDIRMAN NO. 28 JAKARTA, WISMA GKBI LT.1 |10210|KOTA JAKARTA PUSAT|Kec. Tanah Abang|Kel. Bendungan Hilir|IBUKOTA PROPINSI|JABODETABEK|DKI JAKARTA|JAWA|(021) 5740044, 5742525|(021) 5742525
1230|KEMDIKBUD|-6.225492,106.802064|JL. JEND.SUDIRMAN KAV.4-5 , JAKARTA PUSAT|10270|KOTA JAKARTA PUSAT|Kec. Tanah Abang|Kel. Gelora|IBUKOTA PROPINSI|JABODETABEK|DKI JAKARTA|JAWA|(021)  5742463-65|(021) 5742465
1231|BENDUNGAN HILIR D/H GRANADA|-6.207988,106.811074|JL. BENDUNGAN HILIR RAYA BLOK G-1 NO. 3B JAKSEL |10220|KOTA JAKARTA PUSAT|Kec. Tanah Abang|Kel. Karet Tengsin|IBUKOTA PROPINSI|JABODETABEK|DKI JAKARTA|JAWA|(021)  5744736-37 ,5744739, 57951509, 5719526|(021)  5744738
1232|SAMUDERA INDONESIA|-6.197952,106.797319|JL. LETJEN S.PARMAN KAV.35 KEL PALMERAH KEC. PALMERAH, GEDUNG PT. SAMUDERA INDONESIA |11480|KOTA JAKARTA BARAT|Kec. Palmerah|Kel. Kemanggisan|IBUKOTA PROPINSI|JABODETABEK|DKI JAKARTA|JAWA|(021) 5309104 - 05|(021) 5309105
