
36|KUALANAMU|3.638825, 98.877947|BANKING AREA LANTAI 1 BANDARA KUALANAMU, KAB. DELI SERDANG|20732|KAB. DELI SERDANG|Kec. Beringin|Ds. Kualanamu||Luar Jabodetabek|SUMATERA UTARA|SUMATERA|(061)88880526|
74|PASAR SETIA BUDI|3.570945, 98.642812|JL. SETIABUDI,KEL. TANJUNGREJO,KEC. MEDAN SUNGGAL-MEDAN|20132|KOTA MEDAN|Kec. Medan Selayang|Kel. Tanjung Sari|IBUKOTA PROPINSI|Luar Jabodetabek|SUMATERA UTARA|SUMATERA|(061)8217685|
102|PANDAN|1.603237, 98.858047|JL. LINTAS PADANG SIDEMPUAN – SIBOLGA NO. 51-52 KECAMATAN PANDAN, KABUPATEN TAPANULI TENGAH |22611|KAB. TAPANULI TENGAH|Kec. Sibolga|Ds. Pandan||Luar Jabodetabek|SUMATERA UTARA|SUMATERA|(0631)371446|(0631)371046
114|UPPTSP PEMKAB SERDANG BEDAGAI|3.491807, 99.126268|GEDUNG KANTOR PEMKAB SERDANG BEDAGAI|20995|KAB. SERDANG BEDAGAI|Kec. Sungai Rampah|||Luar Jabodetabek|SUMATERA UTARA|SUMATERA||
128|DISKI|3.638825, 98.877947|JL. MEDAN - BINJAI KM 12,5, KEL. PUJI MULYO, KEC. SUNGGAL, KAB. DELI SERDANG|20351|KAB. DELI SERDANG|Kec. Sunggal|Kel Puji Mulyo||Luar Jabodetabek|SUMATERA UTARA|SUMATERA|(061) 8441733|
132|WILAYAH 02 - PADANG|-0.954676,100.359629|JL. DOBI NO. 1 LT. 3 PADANG. |25138|KOTA PADANG|#REF!|#N/A|IBUKOTA PROPINSI|Luar Jabodetabek|SUMATERA BARAT|SUMATERA|(0751) 890005, 890008|(0751) 890010, 890011
133|BUKITTINGGI|-0.306187,100.37008|JL. PERINTIS KEMERDEKAAN NO. 15 - BUKITTINGGI|26111|KOTA BUKITTINGGI|Kec. Guguk Panjang|Kel. Aurtajungkang/Tengah Sawah||Luar Jabodetabek|SUMATERA BARAT|SUMATERA|(0752) 35494, 21565, 22578|(0752) 31695
134|PADANG PANJANG|-0.461224,100.400284|JL. SOEKARNO HATTA NO. 12 - 14. |27115|KOTA PADANG PANJANG|#REF!|Kel. Bukit Surungan||Luar Jabodetabek|SUMATERA BARAT|SUMATERA|(0752) 83746|(0752) 83746
135|AUR KUNING|-0.311571,100.385591|JL. PARAK KUBANG I NO. 76 TAROK DIPO KEC. GUGUK PANJANG KOTA BUKITTINGI|26131|KOTA BUKITTINGGI|Kec. Aur Birugo/Tigobaleh|Kel. Aur Kuning||Luar Jabodetabek|SUMATERA BARAT|SUMATERA|(0752) 642946|(0752) 642946
137|PASAR ATAS|-0.30329, 100.3696|JL. MINANGKABAU NO. 71 BUKITTINGGI|26113|KOTA BUKITTINGGI|Kec. Guguk Panjang|Kel. Benteng Pasar Atas||Luar Jabodetabek|SUMATERA BARAT|SUMATERA|(0752)626565|
138|PADANG LUAR|-0.344869, 100.383958|JL. RAYA BUKITTINGGI - PADANG KM. 4 PASAR PADANG LUAR KAB. AGAM|26181|KAB. AGAM|Kec. Banuhampu Sei Puar|||Luar Jabodetabek|SUMATERA BARAT|SUMATERA|(0752)7839250|(0752)7839251
139|SIMPANG AUR|-0.314927,100.386758|JL DIPONEGORO NO.2 KEL. TAROK DIPO, KEC. GUGUK PANJANG, KOTA BUKITTINGGI|26117|KOTA BUKITTINGGI|Kec. Guguk Panjang|Kel. Tarok Dipo||Luar Jabodetabek|SUMATERA BARAT|SUMATERA|(0752)624750|(0752)624751
140|LUBUK BASUNG|-0.313527, 100.012079|JL. GAJAH MADA NO. 443, LUBUK BASUNG, KAB. AGAM|26452|KAB. AGAM|Kec. Lubuk Basung|kampuang Tengah Sikabu||Luar Jabodetabek|SUMATERA BARAT|SUMATERA|(0752)877946|(0752)877146
141|BATAM|1.143468,104.01422|JL. IMAM BONJOL NO. 23 - BATAM|29432|KOTA BATAM|Kec. Sekupang|Kel. Sungai Harapan||Luar Jabodetabek|KEPULAUAN RIAU|SUMATERA|(0778) 458446, 458405, 458404, 458480|(0778) 459232, 431183
142|HANG NADIM|1.123285,104.115216|LANTAI DASAR BANDARA HANG NADIM - BATAM|29466|KOTA BATAM|#REF!|Kel. Batu Besar||Luar Jabodetabek|KEPULAUAN RIAU|SUMATERA|(0778) 761013|
143|BATAMINDO|1.068369,104.025239|KOMPLEK WISMA BATAMINDO RUKO F NO. 33-34 JL. RASAMALA BATAMINDO INDUSTRIAL PARK - BATAM|29433|KOTA BATAM|Kec. Sungai Beduk|Kel. Mukakuning||Luar Jabodetabek|KEPULAUAN RIAU|SUMATERA|(0770) 612446|(0770) 612799
144|HOTEL PLANET HOLIDAY|1.152006,104.007311|JL. RAJA ALI HAJI - BATAM, KOMPLEK PLANET HOLIDAY HOTEL |29433|KOTA BATAM|Kec. Sungai Beduk|Kel. Mukakuning||Luar Jabodetabek|KEPULAUAN RIAU|SUMATERA|(0778) 4320067, 432068|(0778) 432064
145|SEI PANAS|1.12687,104.03143|JL. LAKSAMANA BINTAN NO. 1 - SEI PANAS - BATAM, BSP BUILDING LT. 1. |29432|KOTA BATAM|Kec. Sekupang|Kel. Sungai Harapan||Luar Jabodetabek|KEPULAUAN RIAU|SUMATERA|(0778) 473246, 473346|(0778) 473146
146|BATAM CENTER DH SUMATERA PROMOTION CENTER|1.101301,103.96130|RUKO HUPSENG BLOK A NO. 17-18, JL. ENGKU PUTRI, BATAM CENTER, KOTA BATAM|29461|KOTA BATAM|Kec. Nongsa|Kel. Teluk Tering||Luar Jabodetabek|KEPULAUAN RIAU|SUMATERA|(0778) 470030|(0778) 470033
147|BATU AJI|1.047264,103.938743|KOMPLEK PERTOKOAN BLOK D NO. 01 DAN 01 A HOOK PERUMNAS FANINDO TANJUNG UNCANG. BATAM|29424|KOTA BATAM|Kec. Sekupang|Kel. Tanjung Uncang||Luar Jabodetabek|KEPULAUAN RIAU|SUMATERA|(0778)3581246|
148|NAGOYA|1.14863,104.00814|KOMPLEK PERTOKOAN NAGOYA BUSINESS CENTER BLOK I NO. 1-2 BATAM|29444|KOTA BATAM|Kec. Lubuk Baja|Kel. Lubuk Baja Kota||Luar Jabodetabek|KEPULAUAN RIAU|SUMATERA|(0778) 452671|(0778) 452672
149|BOTANIA|1.10774,104.02561|RUKO BOTANIA GARDEN NLOK B12 NO.01-02, BOTANIA GARDEN, KEC. BATAM KOTA, KOTA BATAM|29484|KOTA BATAM|#N/A|#N/A||Luar Jabodetabek|KEPULAUAN RIAU|SUMATERA|(0778) 7434046|(0778) 7434146
150|SEKUPANG|1.10830,103.95084|KOMPLEK PERTOKOAN WIJAYA BLOK A NO. 7 DAN 8 SEKUPANG BATAM|29428|KOTA BATAM|Kec. Sekupang|Kel. Sungai Harapan||Luar Jabodetabek|KEPULAUAN RIAU|SUMATERA|(0778)325021|
151|BATU AMPAR|1.16245,104.00343|JL. YOS SUDARSO NO.3 BATU AMPAR, KOTA BATAM|29451|KOTA BATAM|Kec. Batu Ampar|Kel. Batu Merah||Luar Jabodetabek|KEPULAUAN RIAU|SUMATERA|(0778)4277330|(0778)427338
152|SP PLAZA|1.04157,103.98466|KOMPLEKS SENTOSA PERDANA BLOK DD NO.1, KEL. TEMBESI, KEC. SAGULUNG, KOTA BATAM|29439|KOTA BATAM|Kec. Sungai Beduk|Kel. Sagulung||Luar Jabodetabek|KEPULAUAN RIAU|SUMATERA|(0778)395127|(0778)395374
153|KABIL|1.11259,104.13291|RUKO KAWASAN CITRA NUSA NIAGA BLOK A1 NO.1-2 KAWASAN INDUSTRI KABIL, NONGSA,KOTA BATAM|29467|KOTA BATAM|Kec. Nongsa|Kel. Kabil||Luar Jabodetabek|KEPULAUAN RIAU|SUMATERA|(0778)5119946|
154|NAGOYA HILL|1.14340,104.01139|RUKO NAGOYA HILL SUPERBLOK R3 NO. J.35, NAGOYA HILL MALL, KOTA BATAM|29432|KOTA BATAM|Kec. Sekupang|||Luar Jabodetabek|KEPULAUAN RIAU|SUMATERA|(0778)7430346|(0778)7430436
155|BENGKONG|1.158199, 104.025498|JL. SUMATERA KOMPLEK BENGKONG CITY CENTRE, BLOK A NO. 7 KOTA BATAM|29458|KOTA BATAM|#REF!|||Luar Jabodetabek|KEPULAUAN RIAU|SUMATERA|(0778) 495246|
156|SUKAJADI|1.055528, 104.028857|KOMPLEKS DERMAGA CULINARY PARADISE, BLOK RF NO.01 SUKAJADI KOTA BATAM|29432|KOTA BATAM|Kec. Sukajadi|||Luar Jabodetabek|KEPULAUAN RIAU|SUMATERA|(0778) 4084646|(0778) 4082846
163|DUMAI|1.675630, 101.449576|JL. JEND. SUDIRMAN NO. 262 - DUMAI |28813|KOTA DUMAI|Kec. Dumai Timur|Kel. Teluk Binjai||Luar Jabodetabek|RIAU|SUMATERA|(0765) 33332, 34436, 31046|(0765) 31146
164|BENGKALIS|1.469689,102.105303|JL. JEND. A. YANI NO. 12-14 - BENGKALIS |28712|KAB. BENGKALIS|Kec. Bengkalis|Kel. Bengkalis Kota||Luar Jabodetabek|RIAU|SUMATERA|(0766)  22688|(0766) 21866
165|DURI|1.272908, 101.185742|JL. HANG TUAH NO. 22 - DURI|28884|KAB. BENGKALIS|Kec. Mandau|kel. Duri Barat||Luar Jabodetabek|RIAU|SUMATERA|(0765) 596856|(0765) 596857
166|BAGAN BATU|1.702540, 100.640710|JL. JEND. SUDIRMAN NO.161 BAGAN BATU, KEC. BAGAN SINEMBA,KAB. ROKAN HILIR,RIAU|28992|KAB. ROKAN HILIR|Kec. Bagan Sinembah|||Luar Jabodetabek|RIAU|SUMATERA|(0765)551046|
167|SUKAJADI|1.6724861,101.442991|JL. DIPONEGORO NO. 122 DUMAI |28812|KOTA DUMAI|Kec. Dumai Timur|Kel. Sukajadi||Luar Jabodetabek|RIAU|SUMATERA|(022)2037907|
168|SUDIRMAN DURI|1.2784844,101.196108|JL. JEND. SUDIRMAN, NO.14-15 DURI, BENGKALIS|28712|KAB. BENGKALIS|Kec. Bengkalis|Kel. Bengkalis Kota||Luar Jabodetabek|RIAU|SUMATERA|(0765) 94993|(0765) 94992
170|PEKANBARU|0.533846,101.44785|JL. JEND. SUDIRMAN NO. 119 - PEKANBARU|28141|KOTA PEKANBARU|kec. Limapuluh|kel. Rintis|IBUKOTA PROPINSI|Luar Jabodetabek|RIAU|SUMATERA|(0761) 22646, 23346, 33532, 33543, 22563, 40446, 21946|(0761) 21642
171|RUMBAI D/H PT. CALTEX RUMBAI|0.655732,101.439857|JL. YOS SUDARSO NO. 25 A -25 B, KEL. SRI MERANTI, KEC. RUMBAI, KOTA PEKANBARU|28266|KOTA PEKANBARU|Kec. Cintaraja|Kel. Sail|IBUKOTA PROPINSI|Luar Jabodetabek|RIAU|SUMATERA|(0761) 594850|(0761) 594949
172|NANGKA PEKANBARU|0.503433,101.427412|JL TUANKU TAMBUSAI NO. 301 LT. 1 KAV. V PEKANBARU |28282|KOTA PEKANBARU|Kec. Bukit Raya|Kel. Tangkerang Barat|IBUKOTA PROPINSI|Luar Jabodetabek|RIAU|SUMATERA|(0761) 571620|(0761) 571620
173|PANGKALAN KERINCI|0.398112,101.857429|JL. RAYA LINTAS TIMUR RT.001/RW.009 PANGK.KERINCI - KAB. PELALAWAN|28381|KAB. PELALAWAN|#REF!|#N/A||Luar Jabodetabek|RIAU|SUMATERA|(0761) 493745, 493746|(0761) 493747
174|SIAK SRI INDRAPURA|0.793391,102.050607|JL. DR. SOETOMO UJUNG KAB. SIAK SRI INDRAPURA|28621|KAB. SIAK|kec. Siak|||Luar Jabodetabek|RIAU|SUMATERA|(0764) 320846, 320946|(0764) 320746
175|TANGKERANG D/H PASAR PUSAT PEKANBARU|0.505885,101.451579|JL. JEND. SUDIRMAN NO. 365 PEKANBARU |28127|KOTA PEKANBARU|Kec. Pekanbaru Kota|Kel. Simpang Empat|IBUKOTA PROPINSI|Luar Jabodetabek|RIAU|SUMATERA|(0761) 22457, 21346, 859746, 857725, 839654, 859818, 859657|(0761) 34292
176|BANGKINANG|0.345788,101.026867|JL. M. ALI  RASYID NO. 4 BANGKINANG |28411|KAB. KAMPAR|Kec. Bangkinang|Kel. Bangkinang||Luar Jabodetabek|RIAU|SUMATERA|(0762) 322123|(0762) 322789
177|SUKARAMAI PEKANBARU|0.528318,101.447124|JL. JEND. SUDIRMAN, PEKANBARU, PLAZA SUKARAMAI BLOK TB-12, |28112|KOTA PEKANBARU|Kec. Pekanbaru Kota|Kel. Kota Tinggi|IBUKOTA PROPINSI|Luar Jabodetabek|RIAU|SUMATERA|(0761) 856276, 856277|(0761) 856278
178|JL. A.YANI PEKANBARU |0.525397,101.44233|JL. JEND. A. YANI NO. 111 PEKANBARU |28155|KOTA PEKANBARU|#REF!|#N/A|IBUKOTA PROPINSI|Luar Jabodetabek|RIAU|SUMATERA|(0761) 33650|(0761) 33801
179|JALAN RIAU|0.535061,101.428335|JL. RIAU NO. 124 - 124A PEKANBARU|28154|KOTA PEKANBARU|Kec. Senapelan|kel. Kampung Baru|IBUKOTA PROPINSI|Luar Jabodetabek|RIAU|SUMATERA|(0761) 39340|(0761) 21724
180|PANAM|0.463695,101.411469|JL. SOEBRANTAS PANAM, PEKANBARU|28293|KOTA PEKANBARU|Kec. Tampan|Kel. Tampan|IBUKOTA PROPINSI|Luar Jabodetabek|RIAU|SUMATERA|(0761) 567360|(0761) 567043
181|PASIR PENGARAIAN|0.464167,100.80368|JL. TUANKU TAMBUSAI, PASIR PENGARAIAN, KAB. ROKAN HULU, RIAU|28559|KAB. ROKAN HULU|#REF!|#N/A||Luar Jabodetabek|RIAU|SUMATERA|(0762) 7392788,7392789|(0762) 7392790
182|MARPOYAN|0.509141,101.48243|JL. KAHARUDIN NASUTION MARPOYAN KM,11 PEKANBARU|28282|KOTA PEKANBARU|Kec. Bukit Raya|Kel. Tangkerang Barat|IBUKOTA PROPINSI|Luar Jabodetabek|RIAU|SUMATERA|(0761)73403|
183|HARAPAN RAYA|0.503133,101.482086|JL. HARAPAN RAYA, PEKANBARU|28282|KOTA PEKANBARU|Kec. Bukit Raya|Kel. Tangkerang Barat|IBUKOTA PROPINSI|Luar Jabodetabek|RIAU|SUMATERA|(0761)7891639|
184|PERAWANG|0.6722,101.60733|JL. RAYA PERAWANG KM 6, KEL. PERAWANG KOTA, KEC. TUALANG, KAB. SIAK|28772|KAB. SIAK|Kec. Tualang|Kel. Perawang Kota||Luar Jabodetabek|RIAU|SUMATERA|(0761) 92000, 92046|
185|KANDIS|1.132336,101.279241|JL LINTAS SUMATERA UTARA - RIAU KM. 80, KEL. KANDIS KOTA, KEC. KANDIS , KAB. SIAK|28686|KAB. SIAK|Kec. Kandis|||Luar Jabodetabek|RIAU|SUMATERA|(0761)598989|
186|ARIFIN AHMAD|0.4814,101.437596|JL. ARIFIN ACHMAD, KEL. SIDOMULYO, KEC. MARPOYAN, KOTA PEKANBARU|28125|KOTA PEKANBARU|Kec. Sukajadi|Kel. Wonorejo||Luar Jabodetabek|RIAU|SUMATERA|(0761)8415000|
187|UJUNG BATU|0.713138, 100.527133|JL. SUDIRMAN, UJUNG BATU, KAB. ROKAN HULU|28557|KAB. ROKAN HULU|Kec. Ujung Batu|#N/A||Luar Jabodetabek|RIAU|SUMATERA|(0762)7363846|(0762)7363946
188|HANGTUAH|0.519575, 101.482819|JL HANGTUAH NO.18 PEKANBARU|28112|KOTA PEKANBARU|Kec. Pekanbaru Kota|Kel. Kota Tinggi|IBUKOTA PROPINSI|Luar Jabodetabek|RIAU|SUMATERA|(0761)4922173|
193|PADANG|-0.950864,100.366479|JL. PROKLAMASI NO. 45 PADANG |25211|KOTA PADANG|Kec. Padang Selatan|Kel. Alang Lawas Koto|IBUKOTA PROPINSI|Luar Jabodetabek|SUMATERA BARAT|SUMATERA|(0751) 31946, 31948|(0751) 38346
194|AIR TAWAR DH UNIV. NEGERI PADANG|-0.896752, 100.351667|KOMPLEK IKIP JL. AIR TAWAR - PADANG|25132|KOTA PADANG|Kec. Padang Utara|Kel. Air Tawar Timur|IBUKOTA PROPINSI|Luar Jabodetabek|SUMATERA BARAT|SUMATERA|(0751) 41752, 57225|(0751) 41751
195|SITEBA D/H UNIV. BUNG HATTA|-0.896469,100.364339|JL. S. PARMAN NO. 236-I    -   PADANG|25143|KOTA PADANG|#N/A|#N/A|IBUKOTA PROPINSI|Luar Jabodetabek|SUMATERA BARAT|SUMATERA|(0751) 446960, 446962|(0751) 446830
196|DOBI|-0.954676,100.359629|JL. DOBI NO. 1 PADANG|25119|KOTA PADANG|Kec. Padang Barat|Kel. Kampung Dobi|IBUKOTA PROPINSI|Luar Jabodetabek|SUMATERA BARAT|SUMATERA|(0751) 31952,34439, 39606, 30450|(0751)  39754
197|PASAR BARU PADANG DH. UNIV. ANDALAS|-0.927312,100.430772|JL. DR. MOH. HATTA, PASAR BARU, KEC. PAUH, KOTA PADANG|25166|KOTA PADANG|Kec. Pauh|Pasar Baru|IBUKOTA PROPINSI|Luar Jabodetabek|SUMATERA BARAT|SUMATERA|(0751) 71260, 72620|
198|JALAN AHMAD YANI PADANG|-0.94243,100.359173|JL. JEND. A. YANI NO. 18 - PADANG|25112|KOTA PADANG|#REF!|Kel. Jao Dalam|IBUKOTA PROPINSI|Luar Jabodetabek|SUMATERA BARAT|SUMATERA|(0751) 22660, 33037|(0751) 37966, 32820
199|BANDAR BUAT D/H TELUK BAYUR|-0.950508,100.428497|JL. RAYA PADANG-INDARUNG RIMBO DATAR NO.31-32 BANDAR BUAT PADANG |25231|KOTA PADANG|Kec. Lubuk Kilangan|Kel. Bandar Buat|IBUKOTA PROPINSI|Luar Jabodetabek|SUMATERA BARAT|SUMATERA|(0751) 71777|(0751) 714444
200|PARIAMAN|-0.623084, 100.119915|JL. DIPONEGORO NO. 14 - PARIAMAN|25512|KOTA PARIAMAN|Kec. Pariaman Tengah|Kel. Kampung Pondok II||Luar Jabodetabek|SUMATERA BARAT|SUMATERA|(0751) 91346, 92646|(0751) 91146
201|SIMPANG EMPAT PASAMAN|0.10010,99.82322|JL. RAYA SIMPANG IV MANGGOPOH NO. 46 SIMPANG IV - PASAMAN|26566|KAB. PASAMAN|Kec. Kinali|Kel. Kinali||Luar Jabodetabek|SUMATERA BARAT|SUMATERA|(0753) 65081, 65744|(0753) 65746
202|PASAR RAYA PADANG|-0.949442, 100.359798|JL. PASAR RAYA, PASAR BERTINGKAT FASE IV LANTAI II - PADANG|25112|KOTA PADANG|Kec. Padang Barat|Kel. Jao Dalam|IBUKOTA PROPINSI|Luar Jabodetabek|SUMATERA BARAT|SUMATERA|(0751) 812597, 812598|(0751) 812599
205|BY PASS PADANG|-0.948254, 100.400273|JL. BY PASS KM 06 KOTA PADANG|25161|KOTA PADANG|Kec. Pauh|Binuang Kampung Dalam|IBUKOTA PROPINSI|Luar Jabodetabek|SUMATERA BARAT|SUMATERA|(0751)779400|
206|VETERAN PADANG|-0.942422, 100.354716|JL. VETERAN NO. 10 KOTA PADANG|25112|KOTA PADANG|Kec. Padang Barat|Kel. Jao Dalam|IBUKOTA PROPINSI|Luar Jabodetabek|SUMATERA BARAT|SUMATERA|(0781)38546|
212|PAYAKUMBUH|-0.225505,100.629653|JL. SOEKARNO HATTA NO.86 PAYAHKUMBUH |26222|KOTA PAYAKUMBUH|Kec. Payakumbuh Barat|Kel. Parit Rantang||Luar Jabodetabek|SUMATERA BARAT|SUMATERA|(0752) 92945, 92928,  94853, 92805|(0752) 92519
213|BATUSANGKAR|-0.45553,100.59309|JL. SOEKARNO HATTA NO. 3 - BATUSANGKAR, PAYAKUMBUH |27212|KAB. TANAH DATAR|Kec. V Kaum|Kel. Sigarunggung||Luar Jabodetabek|SUMATERA BARAT|SUMATERA|(0752) 72846, 72847, 72788|(0752) 72799
214|PASAR DANGUNG DANGUNG|-0.124896, 100.543046|JL. TAN MALAKA, PASAR DANGUNG DANGUNG|26253|KAB. LIMAPULUH KOTA|Kec. Guguak|Kel. Pincuran betung||Luar Jabodetabek|SUMATERA BARAT|SUMATERA|(0752)748946|(0752)748945
215|RENGAT|-0.37258,102.54571|JL. LETJEN S. PARMAN NO. 55 & 57 RENGAT KEL. KAMPUNG BESAR KOTA (KAMBESKO) KEC. RENGAT, KAB. INDRAGIRI HULU. PROP. RIAU.|29311|KAB. INDRAGIRI HULU|Kec. Rengat|Kel. Kampung Besar Kota||Luar Jabodetabek|RIAU|SUMATERA|(0769) 21008, 21057, 21126, 22151, 323846, 323946, 323150, 21044|(0769) 21471
216|TELUK KUANTAN|-0.52646,101.57213|JL. TUANKU TAMBUSAI NO.46, TALUK KUANTAN|29362|KAB. KUANTAN SINGINGI|Kec. Peranap|||Luar Jabodetabek|RIAU|SUMATERA|(0760) 20046|(0760) 20179
217|AIR MOLEK|-0.37251,102.29299|JL. JEND. SUDIRMAN DESA AIR MOLEK II KEC. PASIR PENYU KAB. INDRAGIRI HULU|29352|KAB. INDRAGIRI HULU|Kec. Pasir Penyu|Kel. Air Molek II||Luar Jabodetabek|RIAU|SUMATERA|(0769) 41856|(0769) 442100
218|BELILAS|-0.52047, 102.416611|JL. LINTAS TIMUR BELILAS, KEL. PANGKALAN KASAI, KEC. SIBERIDA, KAB. INDRAGIRI HULU|29371|KAB. INDRAGIRI HULU|Kec. Siberida|Kel. Pangkalan Kasai||Luar Jabodetabek|RIAU|SUMATERA|(0769) 324106|(0769) 324076
219|UKUI|-0.148953, 102.180668|JL. LINTAS TIMUR, KEC. UKUI, KAB. PELALAWAN|28382|KAB. PELALAWAN|Kec. Pangkalan Kuras|||Luar Jabodetabek|RIAU|SUMATERA|(0769)7445191|(0769)7445192
220|SOREK|0.130978, 102.073543|JL. LINTAS TIMUR SOREK NO.21 KAB. PELALAWAN|28382|KAB. PELALAWAN|Kec. Pangkalan Kuras|||Luar Jabodetabek|RIAU|SUMATERA|(0761)46155|
222|SOLOK|-0.78888,100.65789|JL. KH. AHMAD DAHLAN NO. 99  KELURAHAN PASAR PANDAN AIR MATI, KECAMATAN TANJUNG HARAPAN, KOTA SOLOK|27324|KOTA SOLOK|Kec. Tanjung Harapan|Kel. Pasar Pandan Air Mati||Luar Jabodetabek|SUMATERA BARAT|SUMATERA|(0755) 22815, 22816, 324846|(0755) 324847
223|SAWAH LUNTO|-0.681645,100.777389|JL. A. YANI  KOMPLEK PASAR REMAJA, KEL. PASAR, KEC. LEMBAH SEGAR, KOTA SAWAHLUNTO |27411|KOTA SAWAHLUNTO|Kec. Lembahsegar|Kel. Pasar Remaja||Luar Jabodetabek|SUMATERA BARAT|SUMATERA|(0754)  61588|(0745)   61566
224|KOTOBARU|-1.12745,101.71813|JL. RAYA LINTAS SUMATERA, KOTO BARU - KAB. DAMASRAYA|27681|KAB. DHARMASRAYA|#N/A|#N/A||Luar Jabodetabek|SUMATERA BARAT|SUMATERA|(0754) 71200|(0754) 71400
228|SELAT PANJANG|1.01254,102.70715|JL. MERDEKA NO. 128 SELAT PANJANG |28753|KAB. MERANTI|Kec. Tebing Tinggi|||Luar Jabodetabek|RIAU|SUMATERA|(0763) 31244, 31251, 33944|(0763) 31669
229|SUNGAI PENUH|-2.062767,101.392196|JL. ACHMAD YANI NO. 16 - SUNGAI PENUH|37111|KOTA SUNGAI PENUH|#N/A|#N/A||Luar Jabodetabek|JAMBI|SUMATERA|(0748) 23146, 23246, 23346, 21180|(0748)  22088
230|KAYU ARO|-1.772353,101.290755|JL. RAYAN KERSIK TUO NO.6 KEC. KAYU ARO, KAB. KERINCI.|37163|KAB. KERINCI|Ke. Kayu Aro|||Luar Jabodetabek|JAMBI|SUMATERA|(0748)357046|
232|TEMBILAHAN|0.323917, 103.160333|JL. JEND. SUDIRMAN NO. 78 - TEMBILAHAN|29212|KAB. INDRAGIRI HILIR|Kec. Tembilahan|Kel. Tembilahan Kota||Luar Jabodetabek|RIAU|SUMATERA|(0768) 21946, 21076|(0768) 21040
233|SUNGAI GUNTUNG|0.302665,103.60238|GEDUNG PT SUMATERA TIMUR INDONESIA (SAMBU GROUP), KOMPLEK PT PULAU SAMBU|29255|KAB. INDRAGIRI HILIR|Kec. Kateman|||Luar Jabodetabek|RIAU|SUMATERA|(0779) 552954/59|(0779) 552930
234|PASAR SUNGAI GUNTUNG|0.299475,103.612783|JL. YOS SUDARSO SUNGAI GUNTUNG KEC.KATEMAN, KABI.INDRAGIRI HILIR |29255|KAB. INDRAGIRI HILIR|Kec. Kateman|||Luar Jabodetabek|RIAU|SUMATERA|(0779) 551946|(0779) 551446
235|KOTABARU|0.73945,102.93073|JL. PEMUDA, KEC. KERITANG, KAB. INDRAGIRI HILIR|29274|KAB. INDRAGIRI HILIR|Kec. Keritang|||Luar Jabodetabek|RIAU|SUMATERA||
236|TANJUNG BALAI KARIMUN|0.990384,103.433704|JL. TRIKORA NO. 20, TANJUNG BALAI KARIMUN |29661|KAB. KARIMUN|Kec. Karimun|||Luar Jabodetabek|RIAU|SUMATERA|(0777) 21163, 21063|(0777) 21045
237|TANJUNG BATU|0.660049,103.464503|JL. JEND. SUDIRMAN NO. 88-A, TANJUNG BATU, KUNDUR|29662|KAB. KARIMUN|Kec. Kundur|||Luar Jabodetabek|RIAU|SUMATERA|(0779) 431233, 431446|(0779) 431446
238|MERAL|0.994728,103.412905|JL. A YANI BARAN II, KEC. MERAL, TANJUNG BALAI KARIMUN|29661|KAB. KARIMUN|Kec. Karimun|||Luar Jabodetabek|RIAU|SUMATERA|(0777)326461|
239|SEI LAKAM|0.998418,103.423398|JL. A YANI KOLONG SUNGAI LAKAM, TANJUNG BALAI KARIMUN|29161|KAB. KARIMUN|#REF!|#N/A||Luar Jabodetabek|RIAU|SUMATERA|(0777)23646|
241|TANJUNG PINANG|0.929452, 104.442233|JL. TEUKU UMAR NO. 630 - TANJUNG PINANG|29111|KOTA TANJUNG PINANG|Kec. Tanjungpinang Barat|Kel. Tanjungpinang Kota|IBUKOTA PROPINSI|Luar Jabodetabek|KEPULAUAN RIAU|SUMATERA|(0771) 21521, 23500, 21432, 23642, 21643|(0771) 21716
242|TAREMPA NATUNA|3.217187, 106.216897|JL. HANG TUAH NO. 8 - TERAMPA - NATUNA, RIAU|29791|KAB. ANAMBAS|Kec. Siantan|||Luar Jabodetabek|KEPULAUAN RIAU|SUMATERA|(0772) 31479, 31480|(0772) 31478
243|TANJUNG UBAN|1.06558, 104.21847|JL. PERMAISURI 6-7, TANJUNG UBAN - TANJUNG PINANG|29152|KAB. BINTAN|Kec. Tanjung Uban|||Luar Jabodetabek|KEPULAUAN RIAU|SUMATERA|(0771) 483108, 483109|(0771) 482505
244|BINTAN CENTER|0.916683, 104.503882|JL. DI.PANJAITAN KM IX KOMPLEK PINLANG MAS BLOK MAYANG NO 15A-16 TANJUNG PINANG KEPULAUAN RIAU|29125|KOTA TANJUNG PINANG|#REF!|Ds. Batu IX|IBUKOTA PROPINSI|Luar Jabodetabek|KEPULAUAN RIAU|SUMATERA|(0771) 7447046|(0771) 7447146
245|WIRATNO|0.906819, 104.452969|JL. WIRATNO NO.20-21 KEL. KAMPUNG BATU, KEC. TANJUNG PINANG BARAT KOTA TANJUNG PINANG|29113|KOTA TANJUNG PINANG|Kel. Kampung Batu|Kec. Tanjung Pinang Barat|IBUKOTA PROPINSI|Luar Jabodetabek|KEPULAUAN RIAU|SUMATERA|(0771) 315246|(0771) 317146
246|KIJANG|0.522905, 101.461304|JL. HANG JEBAT KIJANG|29151|KAB. BINTAN|Kec. Bintan Timur|Kel. Kijang Kota||Luar Jabodetabek|KEPULAUAN RIAU|SUMATERA|(0771) 462819|
247|NATUNA|3.9409, 108.3775|JL. DATUK KAYA WAN MUHAMMAD BENTENG, KOTA RANAI, KAB. NATUNA|29783|KAB. NATUNA|Kec. Bunguran Timur|#N/A||Luar Jabodetabek|KEPULAUAN RIAU|SUMATERA|(0773)31473|(0773)31390
248|WILAYAH 03 - PALEMBANG|-2.973909,104.753252|JL. JEND. SUDIRMAN NO. 132 - PALEMBANG|30126|KOTA PALEMBANG|Kec. Ilir Timur I|Kel. 20 Ilir I|IBUKOTA PROPINSI|Luar Jabodetabek|SUMATERA SELATAN|SUMATERA|(0711) 361961 -62-63-65, 321046, 314546, 317560, 319646, 320646|(0711) 361966, 374160
249|BENGKULU|-3.798007,102.266415|JL. S. PARMAN NO. 34 - BENGKULU|38223|KOTA BENGKULU|Kec. Gading Cempaka|Kel. Anggut Bawah|IBUKOTA PROPINSI|Luar Jabodetabek|BENGKULU|SUMATERA|(0736) 23145-46-47-48-49|(0736) 23147
250|MANNA|-4.464833, 102.905938|JL. JEND. SUDIRMAN NO. 165, MANNA - BENGKULU SELATAN |38513|KAB. BENGKULU SELATAN|Kec. Pasar Baru Ibul Manna|Kel. Kota Medan||Luar Jabodetabek|BENGKULU|SUMATERA|(0739) 21886|(0739) 21991
251|CURUP|-3.639149, 102.568939|JL. MERDEKA NO. 75-76 KELURAHAN PASAR BARU, CURUP - BENGKULU.|39112|KAB. REJANG LEBONG|Kec. Curup|Kel. Air Putih Lama||Luar Jabodetabek|BENGKULU|SUMATERA|(0732) 23320|(0732) 21771
252|ARGAMAKMUR|-3.433722,102.192345|JL. SUTAN SYAHRIL NO. 84 - ARGAMAKMUR|38612|KAB. BENGKULU UTARA|Kec. Argamakmur|Kel. Purwodadi||Luar Jabodetabek|BENGKULU|SUMATERA|(0737) 21777, 21888|(0737) 21777
253|PASAR PANORAMA|-3.816617,102.302047|JL. SEMANGKA NO. 45 RT.16/5 PASAR PANORAMA LINGKAR TIMUR |38229|KOTA BENGKULU|Kec. Gading Cempaka|Kel. Dusun Besar|IBUKOTA PROPINSI|Luar Jabodetabek|BENGKULU|SUMATERA|(0736) 21661|(0736) 21245
257|KEPAHIANG|-3.644795,102.5748|JL. SANTOSO, KEL. PASAR UJUNG, KAB. KEPAHIANG|39372|KAB. KEPAHIANG|Kec. Kepahiang|||Luar Jabodetabek|BENGKULU|SUMATERA|(0732)391362|(0732)391362
258|KETAHUN|-3.405145, 102.156484|JL. WIJAYA KUSUMAH PASAR D1 DESA GIRI KENCANA KETAHUN, KOTA BENGKULU|38361|KAB. BENGKULU UTARA|Kec. Ketahun|Ds. Giri Kencana Ketahun||Luar Jabodetabek|BENGKULU|SUMATERA|(0737)7524231|(0737)7524052
259|UNIVERSITAS BENGKULU|-3.759966, 102.272691|JL. WR SUPRATMAN, KANDANG LIMUN, GEDUNG SERBAGUNA UNIV. BENGKULU, KEC. MUARA BANGKAHULU, KOTA BENGKULU|38122|KOTA BENGKULU|Kec. Muara Bangkahulu||IBUKOTA PROPINSI|Luar Jabodetabek|BENGKULU|SUMATERA|(0736) 7321353|
262|BANGKO|-2.071814, 102.275600|JL. JEND. SUDIRMAN NO. 46 BANGKO|37314|KAB. MERANGIN|Kec. Bangko|Kel. Pematang Kandis||Luar Jabodetabek|JAMBI|SUMATERA|(0746) 21835, 22046, 21167|(0746) 21946
263|SAROLANGUN|-2,298418,102,722411|JL. LINTAS SUMATERA NO.14 - SAROLANGUN|37381|KAB. SAROLANGUN|Kec. Jangkat|||Luar Jabodetabek|JAMBI|SUMATERA|(0745) 91900|(0711) 91946
264|HITAM ULU|-1.9789486,102.3823549|PASAR MUARA DELANG RT. 001 RW. 007, DESA MUARA DELANG, KEC. TABIR SELATAN, KAB. MERANGIN|37354|KAB. MERANGIN|TABIR SELATAN|MUARA DELANG||Luar Jabodetabek|JAMBI|SUMATERA|08127418848|
265|SINGKUT|-2.469871,102.710309|JL. LINTAS SUMATERA, KEL. BUKIT TIGA,KEC. SINGKUT, KAB. SAROLANGUN|37482|KAB. SAROLANGUN|Kec. Pelawan Singkut|||Luar Jabodetabek|JAMBI|SUMATERA|(0745) 92124|(0711) 92125
266|BATURAJA|-4.127434,104.165662|JL. SERSAN ZAKARIA NO. 462 - BATURAJA|32115|KAB. OGAN KOMERING ULU|Kec. Baturaja Timur|Kel. Pasarlama||Luar Jabodetabek|SUMATERA SELATAN|SUMATERA|(0735) 325592, 323146|(0735) 320508
267|MUARA DUA|-4.541294,104.049253|JL. JEND.SUDIRMAN NO.11 KEL. PASAR MUARA DUA, KEC.MUARA DUA, KAB. OGAN KOMERING ULU|32211|KAB. OGAN KOMERING ULU SELATAN|Kec. Muaradua|Kel. Muaradua||Luar Jabodetabek|SUMATERA SELATAN|SUMATERA|(0735) 591088|(0735) 590615
268|BELITANG|-4.112454,104.641575|JL. PASAR BARU 146, GUMAWANG BK 10, KEC. BELITANG, KAB. OGAN KOMERING ULU TIMUR|32382|KAB. OGAN KOMERING ULU TIMUR|Kec. Belitang|#N/A||Luar Jabodetabek|SUMATERA SELATAN|SUMATERA|(0735)450446,452246|(0735)451456
269|MARTAPURA|-4.307042,104.331822|JL. MERDEKA, MARTAPURA KAB. OKU TIMUR|32181|KAB. OGAN KOMERING ULU TIMUR|Kec. Martapura|||Luar Jabodetabek|SUMATERA SELATAN|SUMATERA|(0735)481046,481146|(0735)481346
270|BATUMARTA|-4.123176,104.299378|JL. POROS PASAR GOTONG ROYONG, BATUMARTA UNIT II, KAB. OKU|32152|KAB. OGAN KOMERING ULU|kec. Lubuk Raja|Kel. Batumarta||Luar Jabodetabek|SUMATERA SELATAN|SUMATERA|(0735)7328446|
271|JAMBI|-1.591182,103.617049|JL. DR. SUTOMO NO. 20 - JAMBI|36113|KOTA JAMBI|Kec. Pasar Jambi|Kel. Pasar Jambi|IBUKOTA PROPINSI|Luar Jabodetabek|JAMBI|SUMATERA|(0741) 20013-14, 22(061) 22281, 22668, 25013, 34949, 27946, 7075501|(0741) 25102
272|ABADI|-1.593617,103.613513|KOMPLEK PERTOKOAN ABADI BLOK A14-15, JL. GATOT SUBROTO KECAMATAN PASAR JAMBI, JAMBI|36113|KOTA JAMBI|Kec. Pasar Jambi|Kel. Pasar Jambi|IBUKOTA PROPINSI|Luar Jabodetabek|JAMBI|SUMATERA|(0741) 34582|(0741) 7552887
273|SIMPANG SIPIN|-1.620561,103.583175|JL. PATIMURA NO. 100 RT.03/01 KEC. KOTO BARU SLIPIN|36124|KOTA JAMBI|Kec. Telanaipura|Kel. Simpang IV Sipin|IBUKOTA PROPINSI|Luar Jabodetabek|JAMBI|SUMATERA|(0741) 670146|(0741) 670246
274|THE HOK|-1.624895, 103.631061|JL. JENDERAL SUDIRMAN NO. 66 RT.05 KELURAHAN TAMBAK SARI KECAMATAN JAMBI SELATAN KODYA JAMBI|36138|KOTA JAMBI|Kec. Jambi Selatan|Kel. Tambaksari|IBUKOTA PROPINSI|Luar Jabodetabek|JAMBI|SUMATERA|(0741) 7554446|(0741) 7554446
276|MUARA BULIAN|-1.710587,103.25716|JL. JEND. SUDIRMAN NO. 51 KEC. MUARA BULIAN, KOTA MUARA BULIAN, KAB. BATANGHARI, PROVINSI JAMBI|36614|KAB. BATANGHARI|Kec. Muarabulian|Kel. Sridadi||Luar Jabodetabek|JAMBI|SUMATERA|(0743)23346|(0743)22146
277|ABUNJANI|-1.616358,103.593005|JL. PATTIMURA KEL. KENALI BESAR, JAMBI|36129|KOTA JAMBI|Kec. Telanaipura|Kel. Selamat|IBUKOTA PROPINSI|Luar Jabodetabek|JAMBI|SUMATERA|(074)1669446|(074)1669447
278|ANGSO DUO|-1.592158,103.616201|JL. SAM RATULANGI NO.36-38 PASAR JAMBI, JAMBI|36113|KOTA JAMBI|Kec. Pasar Jambi|Kel. Pasar Jambi|IBUKOTA PROPINSI|Luar Jabodetabek|JAMBI|SUMATERA|(0741)24446|
